{"_type":"https://in-toto.io/Statement/v1","predicate":{"bundle_version":"0.1","completeness":"incomplete","event_count":7,"generator":{"name":"aureproof","version":"tutorial"},"journal_head":"sha256:7096e3b06b9de510e93673fa87943eafd671e722d15924faebfe0b041368fe84","versions":{"contracts":"0.1","disposition":"0.1.0","matcher":"0.1.0","metrics":"0.1.0","scoring_profile":"sha256:512fa1e98bb368ad6f60639518041beed77f982664827b242d3f49114c1616f0","scoring_spec":"0.1"}},"predicateType":"https://github.com/bhargavchintam/aureproof/blob/main/specs/bundle/README.md#predicate-v01","subject":[{"digest":{"sha256":"0a9731d773c2df690f83f8adf4cc28a1f7c1c27384bdc121e93437e2939e4246"},"name":"manifest.json"}]}