{"_type":"https://in-toto.io/Statement/v1","predicate":{"bundle_version":"0.1","completeness":"complete","event_count":32,"generator":{"name":"aureproof","version":"gate-example"},"journal_head":"sha256:7509e6a225ce998bd3e4ba34912d44faa5a3fbf7992720bb0a10bc1f54509a4b","versions":{"contracts":"0.1","disposition":"0.1.0","matcher":"0.1.0","metrics":"0.1.0","scoring_profile":"sha256:512fa1e98bb368ad6f60639518041beed77f982664827b242d3f49114c1616f0","scoring_spec":"0.1"}},"predicateType":"https://github.com/bhargavchintam/aureproof/blob/main/specs/bundle/README.md#predicate-v01","subject":[{"digest":{"sha256":"76ca5ad16b4ee4372f4649cb7ebf5936ff2712bf4a7ba0bcaecfed71cd02e1c1"},"name":"manifest.json"}]}