{"_type":"https://in-toto.io/Statement/v1","predicate":{"bundle_version":"0.1","completeness":"complete","event_count":86,"generator":{"name":"aureproof","version":"0.0.0"},"journal_head":"sha256:63e913220039a0148dc72806357ec0582e246c4e9ae55b839dd4cee826c9f0be","versions":{"contracts":"0.1","disposition":"0.1.0","matcher":"0.1.0","metrics":"0.1.0","scoring_profile":"sha256:512fa1e98bb368ad6f60639518041beed77f982664827b242d3f49114c1616f0","scoring_spec":"0.1"}},"predicateType":"https://github.com/bhargavchintam/aureproof/blob/main/specs/bundle/README.md#predicate-v01","subject":[{"digest":{"sha256":"e184573f96f61cdf807b96dbf92cf593860079f89814a4110d586e73c5616f4d"},"name":"manifest.json"}]}